[
  {
    "questionId": "som-y8-021",
    "questionType": "MCQ",
    "stem": "You leave ice cream out on a hot Australian summer day. Within 10 minutes, it becomes a puddle of liquid.\n\nWhich statement best explains what happened to the **particles** in the ice cream?",
    "mcqOptions": [
      {
        "id": "A",
        "text": "The particles melted and became liquid particles",
        "isCorrect": false,
        "feedback": "Particles don't 'melt' - they are already the smallest units. The particles themselves don't change, only their arrangement and movement."
      },
      {
        "id": "B",
        "text": "The particles gained energy, moved faster, and broke free from fixed positions",
        "isCorrect": true,
        "feedback": "Correct! Heat energy increased the kinetic energy of particles. This caused them to vibrate faster, overcome the forces holding them in place, and start sliding past each other (becoming liquid)."
      },
      {
        "id": "C",
        "text": "The heat destroyed the solid particles and created new liquid particles",
        "isCorrect": false,
        "feedback": "Particles are not destroyed during melting. The same particles that were in the solid ice cream are now in the liquid - they've just changed how they move."
      },
      {
        "id": "D",
        "text": "The sun's rays pushed the particles apart",
        "isCorrect": false,
        "feedback": "Heat doesn't 'push' particles. It transfers energy to particles, increasing their motion, which allows them to overcome attractive forces."
      }
    ],
    "solution": "The answer is **B**.\n\nWhen ice cream melts:\n1. **Heat energy** from the surrounding air transfers to the ice cream particles\n2. Particles gain **kinetic energy** and begin vibrating faster\n3. Eventually they have enough energy to **overcome the forces** holding them in fixed positions\n4. Particles can now **slide past each other** - this is the liquid state\n\nThe particles themselves haven't changed - they're the same molecules. Only their **arrangement** (from ordered to disordered) and **movement** (from vibrating in place to sliding) has changed.",
    "hints": [
      {
        "level": 1,
        "content": "Think about what heat does to particles. Does it change what they are, or how they behave?",
        "revealsCriticalInfo": false
      },
      {
        "level": 2,
        "content": "In a solid, particles are locked in position. What must happen for them to become a liquid where they can flow?",
        "revealsCriticalInfo": true
      }
    ],
    "difficulty": 2,
    "estimatedTime": 90,
    "curriculum": {
      "system": "NSW",
      "codes": ["ACSSU151"],
      "year": 8,
      "subject": "Science",
      "strand": "Chemical Sciences"
    },
    "learningArc": {
      "phase": 2,
      "phasePosition": 1,
      "conceptsUsed": ["c1", "c6", "c7"],
      "buildsOn": ["som-y8-006", "som-y8-012"],
      "preparesFor": ["som-y8-025", "som-y8-041"]
    },
    "pedagogy": {
      "type": "phenomenon",
      "phenomenonId": "p1",
      "targetFeeling": "This is how it works in real life!"
    },
    "richContent": {
      "hasEquations": false,
      "hasTables": false,
      "hasDiagrams": false
    },
    "paperMetadata": {
      "section": "year8-science",
      "setId": "year8-states-of-matter-phase2",
      "sequenceInPaper": 21
    },
    "status": "draft"
  },
  {
    "questionId": "som-y8-022",
    "questionType": "MCQ",
    "stem": "You step out of a hot shower and notice steam rising from your skin and disappearing into the air.\n\nWhat happens to the water particles when the steam 'disappears'?",
    "mcqOptions": [
      {
        "id": "A",
        "text": "They stop existing - the water is destroyed",
        "isCorrect": false,
        "feedback": "Matter cannot be created or destroyed. The water particles still exist - they've just spread out so much you can't see them."
      },
      {
        "id": "B",
        "text": "They slow down and become invisible solid particles",
        "isCorrect": false,
        "feedback": "The particles don't become solid. They remain as gas particles spread out in the air."
      },
      {
        "id": "C",
        "text": "They spread far apart into the surrounding air as gas particles",
        "isCorrect": true,
        "feedback": "Correct! The water vapour (gas) particles spread out through the air by diffusion. They're still there as a gas, just too spread out to see."
      },
      {
        "id": "D",
        "text": "They combine with air particles to form a new substance",
        "isCorrect": false,
        "feedback": "The water particles remain as water (H₂O). They mix with air but don't combine chemically."
      }
    ],
    "solution": "The answer is **C**.\n\nWhen steam 'disappears':\n1. **Water vapour** is water in the gas state - particles are moving fast and far apart\n2. Through **diffusion**, these fast-moving particles spread into the surrounding air\n3. They become so **spread out** that we can't see them anymore (below visible concentration)\n4. The particles are still **water molecules (H₂O)** - they haven't changed chemically\n\nVisible steam near your body is actually tiny water droplets suspended in air. As these spread out and mix with dry air, they become invisible water vapour.",
    "hints": [
      {
        "level": 1,
        "content": "Can matter just disappear? What does conservation of mass tell us?",
        "revealsCriticalInfo": false
      },
      {
        "level": 2,
        "content": "Gas particles spread out rapidly. What happens when water vapour particles spread into a large room?",
        "revealsCriticalInfo": true
      }
    ],
    "difficulty": 2,
    "estimatedTime": 90,
    "curriculum": {
      "system": "NSW",
      "codes": ["ACSSU151"],
      "year": 8,
      "subject": "Science",
      "strand": "Chemical Sciences"
    },
    "learningArc": {
      "phase": 2,
      "phasePosition": 2,
      "conceptsUsed": ["c5", "c8"],
      "buildsOn": ["som-y8-009", "som-y8-015"],
      "preparesFor": ["som-y8-028", "som-y8-045"]
    },
    "pedagogy": {
      "type": "phenomenon",
      "phenomenonId": "p2",
      "targetFeeling": "This is how it works in real life!"
    },
    "richContent": {
      "hasEquations": false,
      "hasTables": false,
      "hasDiagrams": false
    },
    "paperMetadata": {
      "section": "year8-science",
      "setId": "year8-states-of-matter-phase2",
      "sequenceInPaper": 22
    },
    "status": "draft"
  },
  {
    "questionId": "som-y8-023",
    "questionType": "MCQ",
    "stem": "A student puts a spoonful of sugar into hot tea and stirs it. The sugar seems to 'disappear'.\n\nAnother student puts an ice cube on a warm plate. The ice seems to 'disappear' too.\n\nWhat is the difference between these two situations?",
    "mcqOptions": [
      {
        "id": "A",
        "text": "Both are the same process - melting",
        "isCorrect": false,
        "feedback": "Only the ice is melting (changing state). The sugar undergoes a different process."
      },
      {
        "id": "B",
        "text": "Both are the same process - dissolving",
        "isCorrect": false,
        "feedback": "Only the sugar is dissolving (mixing with a solvent). Ice changes state without a solvent."
      },
      {
        "id": "C",
        "text": "Sugar dissolves (mixes with water), ice melts (changes from solid to liquid)",
        "isCorrect": true,
        "feedback": "Correct! Dissolving and melting are different processes. Sugar particles spread out among water particles (dissolving). Ice particles gain energy and change from solid to liquid state (melting)."
      },
      {
        "id": "D",
        "text": "Sugar melts (becomes liquid sugar), ice dissolves (mixes with air)",
        "isCorrect": false,
        "feedback": "This has the processes reversed. Sugar dissolves in water; ice melts into liquid water."
      }
    ],
    "solution": "The answer is **C**.\n\n**Dissolving** (sugar in tea):\n- Sugar particles **separate** and spread out among water particles\n- The sugar is still there - just mixed with the water\n- This requires a **solvent** (liquid to dissolve into)\n- It's a **mixing** process, not a state change\n\n**Melting** (ice on plate):\n- Ice particles gain energy and change from **solid to liquid**\n- This is a **change of state**\n- No mixing with another substance is required\n- The particles stay together, just in a different arrangement\n\nThis addresses the common misconception that melting and dissolving are the same!",
    "hints": [
      {
        "level": 1,
        "content": "Does sugar need something else (like water) to 'disappear'? Does ice?",
        "revealsCriticalInfo": false
      },
      {
        "level": 2,
        "content": "Dissolving involves mixing particles. Melting involves changing the arrangement and movement of particles within the same substance.",
        "revealsCriticalInfo": true
      }
    ],
    "difficulty": 3,
    "estimatedTime": 120,
    "curriculum": {
      "system": "NSW",
      "codes": ["ACSSU151"],
      "year": 8,
      "subject": "Science",
      "strand": "Chemical Sciences"
    },
    "learningArc": {
      "phase": 2,
      "phasePosition": 3,
      "conceptsUsed": ["c6", "c7"],
      "buildsOn": ["som-y8-007", "som-y8-014"],
      "preparesFor": ["som-y8-043", "som-y8-044"]
    },
    "pedagogy": {
      "type": "misconception",
      "misconceptionId": "m6",
      "targetFeeling": "This is how it works in real life!"
    },
    "richContent": {
      "hasEquations": false,
      "hasTables": false,
      "hasDiagrams": false
    },
    "paperMetadata": {
      "section": "year8-science",
      "setId": "year8-states-of-matter-phase2",
      "sequenceInPaper": 23
    },
    "status": "draft"
  },
  {
    "questionId": "som-y8-024",
    "questionType": "MCQ",